{"cohort":"production","districts_geojson":{"features":[{"geometry":{"coordinates":[[[[72.6,61.08],[72.64,61.08],[72.64,61.1],[72.6,61.1],[72.6,61.08]]]],"type":"MultiPolygon"},"id":"12","properties":{"active":true,"geometry_sha256":"166b17426d9a831136a5a1afcf7bb516aecffa9ce015fdee91a951c9a23a0878","name":"Пример микрорайона","source_district_id":"12"},"type":"Feature"}],"type":"FeatureCollection"},"schema_version":"1.0","source_instance_id":"00000000-0000-4000-8000-000000000000-production","statuses":["RECEIVED","PROCESSING","ACCEPTED","NEEDS_REVIEW","REJECTED","DUPLICATE","FORWARDED","ERROR","SPAM"],"storage_statuses":["PENDING","ERROR","SYNCED","NOT_REQUIRED"],"work_types":[{"code":"DEICING_MANUAL","name":"ПГМ"},{"code":"SNOW_MANUAL","name":"ПОДХОДЫ"},{"code":"BIN_EMPTYING","name":"УРНЫ"},{"code":"LAWN_LITTER","name":"МУСОР_ГАЗОН"},{"code":"DRAIN_CLEANING","name":"КОЛОДЦЫ"},{"code":"METAL_CUTTING","name":"АРМАТУРА"},{"code":"PLAYGROUND_MAINTENANCE","name":"ПЛОЩАДКИ"},{"code":"UNPAVED_LITTER","name":"СЛУЧ_МУСОР"},{"code":"SWEEPING","name":"ПОДМЕТАНИЕ"},{"code":"BIN_WASHING","name":"МОЙКА_УРН"},{"code":"LAWN_RAKING","name":"ГРАБЛИ"},{"code":"GREEN_CLEANING","name":"ГАЗОН"},{"code":"GRASS_MOWING","name":"ПОКОС"},{"code":"PAVING_WASHING","name":"БРУСЧ_МОЙКА"},{"code":"SNOW_MECHANICAL","name":"МЕХ_СНЕГ"},{"code":"SNOW_REMOVAL","name":"ВЫВОЗ_СНЕГА"}]}